61002553,https://en.wikipedia.org/wiki/Committee_Against_Torture,Committee Against Torture,"Abstract. The Committee Against Torture (CAT) is a treaty body of human rights experts that monitors implementation of the United Nations Convention against Torture by state parties. The committee is one of eight UN-linked human rights treaty bodies. All state parties are obliged under the convention to submit regular reports to the CAT on how rights are being implemented. Upon ratifying the convention, states must submit a report within one year, after which they are obliged to report every four years. The committee examines each report and addresses its concerns and recommendations to the state party in the form of ""concluding observations."" Under certain circumstances, the CAT may consider complaints or communications from individuals claiming that their rights under the convention have been violated. The CAT usually meets in April/May and November each year in Geneva. Members are elected to four-year terms by state parties and can be re-elected if nominated. Tasks and activities. Rules of Procedure of the CAT. In order to carry out its duties as defined in Part II FoC, the committee established a Rules of Procedure (VerfO) governing the organization, procedures and responsibilities of the committee (Article 18 (2) FoK). It is also based on the Addis Ababa directive on the independence and impartiality of UN treaty bodies. It consists of 2 parts, Part I. General Provisions and Part II. Provisions relating to the tasks of the committee. It is further subdivided into 19 chapters and contains 121 rules (version /C/3/Rev.6). These are numbered and in a revision of the VerfO the rules get new numbers. In the revision on February 21, 2011, in Chap. 17 and 21 introduced a follow-up procedure to review the implementation of the committee's recommendations, stating that states ignored its recommendations. The relevant chapters of the VerfO are: Examination of the state reports. The predominant activity is to examine the statements of account of the contracting states, in which they must state how they implemented the contract(Art. 19 FoK). The course of the examination is described in chap. 17 of the VerfO regulated. The states must submit an initial report to the committee within one year of the conclusion of the contract, followed by a periodic report about every four years thereafter. If a state does not submit a report, the committee notes this in its annual report to the United Nations General Assembly (Resolution 67 RMA). Due to the overloading of the committees, the Simplified Reporting Procedure was introduced by the UN General Assembly. If no material shortcomings have been identified at the time of the last review of a country report, the committee can now proceed with the simplified procedure, in which it issues to the contracting parties a list of issues before reporting (LOIPR). Replies to LOIs) are then considered as periodic state reports (Rule 66 RMA). Non-governmental organizations (NGOs) and national human rights organizations (NHRIs) can also actively participate in the state reporting process and submit parallel reports to the state reports in order to show that the implementation of the civil pact by the contracting states is insufficient. In the process, gaps or errors in the state report can be clarified and deficits pointed out. The report review takes place in public meetings in which the committee examines whether the state party correctly implemented the Torture Convention and how it could remedy existing shortcomings (Rule 70 RMA). For the participation of third parties in the public hearing, an admission is required (English Accreditation). If a state fails to file a report despite being warned, the committee examines the implementation of the FoK based on the parallel reports submitted by the NGOs and NHRIs and notes this in its annual report to the UN General Assembly (Rule 67 RMA). If the committee determines during the audit that the state has failed to implement the agreement, it may submit proposals to remedy the deficiencies (Article 19 (3) FoK, Rule 71 of the VerfO). These proposals are called Concluding Observations. These proposals of the CCPR are not legally binding, implementation can not be enforced and only a follow-up procedure is foreseen, in which a rapporteur examines the implementation by the state (Rule 72 RMA). If necessary, the same proposals will be made at the next state report. Since some states are late in submitting their reports, the United Nations High Commissioner for Human Rights (UNHCHR) has drawn up a list of states submitting their reports on time (e.g. Italy, Switzerland, etc.) and a list of those who are in Arrears (e.g. Germany, Liechtenstein, Austria, the Vatican etc.). Investigation process. The Anti-torture Convention also includes an inquiry procedure which empowers the committee to conduct investigations when reliable information is available on serious or systematic NPT violations by a state party and seeks the cooperation of the state party concerned (Article 20) FoK). This examination procedure is regulated in Chapter 19 of the VerfO. The condition for this is that the state explicitly rejected this when ratifying the treaty (Article 28 (1) FoK). The state is asked by the committee to participate in the investigation proceedings and to provide information on these suspicions (Article 20 (1) FoK, Rule 82 et seq. First of all, the information received is examined (Rule 81 et seq. Of the VerfO) and, if the suspicion has been substantiated, an investigation is carried out, in which case the committee can also conduct investigations in the affected state if the state agrees. Upon completion of the investigation, the committee will send the investigation report to the state concerned and, if it finds any instances of maladministration, appropriate recommendations on how to remedy them (Rule 89 RCD). To date, 10 such studies have been performed. These were: Egypt (2017), Lebanon (2014), Nepal (2012), Brazil (2008), Serbia and Montenegro (2004), Mexico (2003), Sri Lanka (2002), Peru (2001), Egypt (1996), Turkey (1994) The recommendations of the committee are not legally binding, their implementation can not be enforced. Apart from the fact that he can carry out a follow-up procedure to review the implementation of the recommendations or that the implementation of the recommendations will be discussed in the next state report, no further measures are foreseen (Article 20 (5) FoK, Rule 90). If the committee is confronted with such serious or systematic torture by a state, it may also bring the matter to the attention of the UN General Assembly. The latter then decide on the further course of action, because extensive or systematic violations of the torture prohibition are considered crimes against humanity according to Art. 7 (1) of the Rome Statute and the International Criminal Court in The Hague is responsible for this, provided that the fallible state does not the International Criminal Court. State Cases. This procedure is regulated in Chapter 20 of the VerfO. The committee is empowered to consider cases of state where a contracting state claims that another state party is failing to fulfill its obligations under the Convention against Torture (Article 21 FoK). The condition for this is that both states explicitly recognized the competence of the committee when ratifying the treaty (Article 21 (1) FoK, Rule 91, 97 VerO). In contrast to individual complaints, there are no high formal requirements for state complaints, and the UNHCHR Secretariat is not authorized to declare state complaints inadmissible, as in the case of individual complaints (Art. 22 (5) FoK Individual Complaints, Rule 111 ff. The task of the committee is to settle the dispute (Article 21 (1) lit e FoK, Rule 98 of the Rules of Procedure). If no amicable agreement is reached, a final report will be prepared, completing the procedure for the committee (Article 21 (1) (h), (ii) FoK, Rule 101 of the VerfO). For international disputes, there are rules, u. a. the agreement for the peaceful settlement of international disputes The states can then turn to the International Court of Justice within six months, provided that neither of the two states made a reservation in the ratification of the treaty (Article 30 FoK). As a precautionary measure, 12 states rejected the jurisdiction of the International Court of Justice when concluding the contract (Article 30 (1) FoK). States do not necessarily have to refer to the International Court of Justice, there is also a European Convention on the Peaceful Settlement of Disputes. For example, on 16 December 1971, Ireland lodged a complaint against England with the ECMR for failing to comply with the prohibition of torture under Article 3 of the ECHR. Ireland could not file the complaint with either the CAT or the CCPR (Article 7 IpbpR), as they did not enter into force until about 10 years later. General remarks. The committee publishes general comments on the interpretation and specification of the various provisions of the Torture Convention. They are intended to clear up misunderstandings and to assist the contracting states in the fulfillment of their contractual obligations. To date, the committee has written four General Comments (GC). Members of the CAT. The members appointed under Art. 17 FoK for four years each Decisions of the CAT. The figures are without the complaints already rejected by the Secretariat of the United Nations High Commissioner for Human Rights (OHCHR).The individual decisions can also be found in the database of the UNO. Further Information."
3136056,https://en.wikipedia.org/wiki/Voyage_(Ayumi_Hamasaki_song),Voyage (Ayumi Hamasaki song),"Abstract. ""Voyage "" is the 28th single released by Ayumi Hamasaki on September 26, 2002. ""Voyage"" debuted at #1 on the weekly charts with more than 319,020 copies sold in its first week and remained at the top position for three consecutive weeks out of a total 28 weeks on the chart, becoming her longest-charting single. The single sold a total of 760,000 copies and became the ninth-best-selling single of the year. To date, ""Voyage"" is Ayumi Hamasaki's only single which has remained in the top position of the weekly Oricon charts for at least three weeks other than ""H"" and ""A""; however, ""Voyage"" is Hamasaki's only single to stay at #1 for three consecutive weeks (""A"" and ""H"" spent 3 non-consecutive weeks at #1). ""Voyage"" was used as the theme song of the Japanese film Tsuki ni Shizumu, which was created in lieu of a PV for the single. It was also used as the ending song of a Japanese television drama My Little Chef, starring Hiroshi Abe and Aya Ueto. Track listing. PV. A regular PV for ""Voyage"" does not exist; however, Tsuki ni Shizumu, a short film starring Hamasaki was created for which ""Voyage"" was used as the theme song. The video starts with a young woman named Minamo (played by Hamasaki) is at a mental institution and has recurring detailed visions of a traumatizing past life. Her visions include a lake with a large image of the moon shining down over it. She is crying tears of blood as she slowly sinks into the lake. She hears someone calling her name ""Kagari"" which was her name in her past life. At the mental hospital she eventually stumbles across a visitor which causes her to go wild and reach out to him as if she had already known him. The doctor believes that Minamo died a traumatizing death in her previous life and therefore she needs to become reunited with her soul mate in this life. In her past life, there is a deranged madwoman who insists that Kagari (Minamo) must be sacrificed to the moon because a special full moon was approaching which only showed up once every hundred years. When the madwoman shows up with her goons to kill Kagari and sacrifice her to the moon, Kagari's soul mate Sonshin (played by Yūsuke Iseya) shows up to try and defend her. Kagari and Sonshin get away from the fiends and spend one final loving moment together. Soon after, the psychopathic woman and her group of minions track Kagari down and brutally kill Sonshin for trying to defend Kagari. Eventually the demented woman ends up getting Kagari and sacrificing her to the moon once and for all. This leads to a gorgeous scene in which Kagari sinks into the shining light of the moon on a lake. Back in the present time, Minamo finds the lake where she was traumatically sacrificed to the moon in her past life. She meets up with the visitor from the hospital who was also the man in her visions: Sonshin, or Shōgo (in present). They briefly speak and realize that they were in fact each others' soul mates and become reunited for good. The video ends with Minamo and Shōgo hugging. Charts. Oricon sales chart (Japan)"
23311224,https://en.wikipedia.org/wiki/Zack_Kassian,Zack Kassian,"Abstract. Zack Adam Kassian (born January 24, 1991) is a Canadian professional ice hockey winger who is currently playing for HC Sparta Praha in the Czech Extraliga. During his junior career, he won a Memorial Cup with the Windsor Spitfires in 2010. Selected 13th overall in the 2009 NHL Entry Draft, he began his career within the Buffalo Sabres organization before being traded to the Vancouver Canucks in 2012. He played parts of four seasons with the Canucks before they traded him to the Montreal Canadiens in 2015. Kassian never played for the Canadiens, however, as he was suspended for substance abuse issues, and was traded to the Edmonton Oilers several months later. After seven seasons in Edmonton, Kassian was traded to the Arizona Coyotes, spending one season there before retiring during the 2023–24 NHL season. Internationally, he competed with Canada's under-20 team at the 2011 World Junior Championships and won a silver medal. Listed at 6 ft 3 in (191 cm) and 211 lb (96 kg), Kassian played in the style of a power forward and was known for playing with aggression and physicality. Early life. Kassian was born in Windsor, Ontario, to parents Mike and Shirley Kassian. Though often mistaken for having Armenian heritage, Kassian is not of Armenian descent. He has two older sisters and an older brother, Mike Jr. When he was eight, his father died of a heart attack. Kassian has recalled his father's role as having been filled by Mike Jr., who was nineteen at the time, while he grew up. He grew up attending Queen of Peace elementary school in Leamington, Ontario and first began playing organized hockey at the age of eight with the Kingsville Kings. Growing up, he was a Toronto Maple Leafs fan, though he has listed his favourite players as Boston Bruins defenceman Bobby Orr and Todd Bertuzzi, a fellow power forward who was starring with the Vancouver Canucks during Kassian's youth. Playing career. International play. Kassian debuted internationally with Hockey Canada at the 2008 World U-17 Hockey Challenge, competing for Team Ontario. He recorded two goals and six points over six games as Ontario won the gold medal. The following year, he moved on to the under-18 level with Canada at the 2009 IIHF World U18 Championships. With two goals and five points over six games, he helped Canada to a fourth-place finish. Two years later, Kassian joined Canada's under-20 team for the 2011 World Junior Championships in Buffalo, New York. During the tournament, he received a two-game suspension for a hit against Czech defenceman Petr Senkerik, making contact with Senkerik's chin with his shoulder. Kassian returned for the medal round and helped Canada to the gold medal game, where they lost 5–3 to Russia. He finished the tournament with two goals and an assist over five games."
54747269,https://en.wikipedia.org/wiki/The_Dinah_Shore_Show_(radio_program),The Dinah Shore Show (radio program),"Abstract. The Dinah Shore Show was a title applied—in some cases specifically and in other cases generically—to several radio musical programs in the United States, some of which had other distinct titles as indicated below. Singer Dinah Shore starred (or in some cases co-starred) in the programs, some of which were broadcast on the Blue Network, while others were on CBS or NBC. Format. All of the programs featured vocal music by Shore. Comedy and musical performances by other people were often included. The Dinah Shore Show (1939–1940). Shore's first radio program began on August 6, 1939, on the Blue Network. The 15-minute program was broadcast on Sunday evenings, with Paul Lavalle leading the orchestra. That series ended on January 14, 1940. A similar Friday-night program began on the same network on June 14, 1940, with Irving Miller in charge of the music. It ended on September 27, 1940. Songs by Dinah Shore (1941–1942). On November 2, 1941, Shore began a 15-minute program on NBC-Blue, sponsored by Bristol Myers. Shore continued to sing on Eddie Cantor's weekly program, which had the same sponsor. Gordon Jenkins was the program's music director. Harry von Zell was the announcer and a foil for comedy segments. The program ended on April 26, 1942. In Person, Dinah Shore (1942–1943). Originating in Hollywood, this 15-minute program ran from May 1, 1942, to April 23, 1943 on the Blue Network. Truman Bradley was the announcer, and Gordon Jenkins was in charge of the music. William L. Lawrence was the producer. The sponsor was Bristol-Myers. The Bird's Eye Open House (1943–1946). Beginning September 30, 1943, Shore starred in The Bird's Eye Open House on CBS. Originating in Hollywood on station KNX, the half-hour show was the first network radio program sponsored by that frozen food brand. Each weekly episode included comedy segments featuring Cornelia Otis Skinner and Roland Young and performances from the Joseph Lilley Singers. The music director was Robert Emmett Dolan. Harry von Zell was the announcer. Ben Brady and Glenn Wheaton were the program's writers. Glenhall Taylor, Walter Bunker, and Arthur Moore were the producers. On October 5, 1944, the program shifted to NBC, where it continued until May 30, 1946. The Ford Show (1946–1947). Beginning September 18, 1946, Ford Motor Company began sponsoring Shore's program. Shore moved back to CBS, with comedian Peter Lind Hayes featured. Dolan handled the music once again. Abe Burrows was a writer, and the producer was Billy Wilgus. The 30-minute show ended June 11, 1947. Call for Music (1948). Sponsored by Philip Morris cigarettes, Call for Music replaced It Pays to Be Ignorant on CBS on February 13, 1948. Johnny Mercer and Harry James co-starred with Shore. The program switched to NBC on April 20, 1948. A story in the trade publication Broadcasting noted, ""The show's format was composed and designed to catch the audience of 18 to 25 years old."" John Holbrook and Jack Rourke were the announcers. The Dinah Shore Show (1953–1955). Sponsored by Chevrolet Dealers, The Dinah Shore Show as heard on NBC Radio was a simulcast of the sound portion of Shore's television program on NBC."
3720182,https://en.wikipedia.org/wiki/Joseph_Hirshhorn,Joseph Hirshhorn,"Abstract. Joseph Herman Hirshhorn (August 11, 1899 – August 31, 1981) was an entrepreneur, financier, and art collector. Biography. Born in Mitau, Latvia, the twelfth of thirteen children, Hirshhorn emigrated to the United States with his widowed mother at the age of six. Hirshhorn went to work as an office boy on Wall Street at age 14. Three years later, in 1916, he became a stockbroker and earned $168,000 that year. A shrewd investor, he sold off his Wall Street investments two months before the collapse of 1929, realizing $4 million in cash. Hirshhorn made his fortune in the mining and oil business. In the 1930s, he focused much of his attention on gold and uranium mining prospects in Canada, establishing an office in Toronto in 1933. In the 1950s, he and geologist Franc Joubin were primarily responsible for the ""Big Z"" uranium discovery in northeastern Ontario and the subsequent founding of the city of Elliot Lake. Hirshhorn Avenue, a residential street in that city, is named after him. By 1960, when he sold the last of his uranium stock, he had made over $100 million in cash from the uranium business. From 1961 to 1976, Hirshhorn lived in a three-story Norman chateau in a 22-acre (89,000 m) estate at the summit of Round Hill, a 550-foot (170 m) rise in north-central Greenwich, Connecticut, with a view of the Manhattan skyline. Art collecting. When Hirshhorn began to make money, he began to buy art, both paintings and sculpture. He amassed a collection of paintings and sculptures from the 19th and 20th centuries. Applying himself seriously to the study of art, he would question dealers, critics, and curators, and visit artists in their studios. He made quick decisions on buying a piece. ""If you've got to look at a picture a dozen times before you make up your mind"", he once said, ""there's something wrong with you or the picture"". Hirshhorn graced his Greenwich mansion with paintings by Joseph Glasco (and sculpture), Willem de Kooning, Raphael Soyer, Jackson Pollock, Larry Rivers, and Thomas Eakins, and the grounds outside with sculptures by Auguste Rodin, Pablo Picasso, Henri Matisse, Alberto Giacometti, Alexander Calder, Richard Bernstein (artist), George Rickey, and Henry Moore. He allowed many nonprofit groups to use tours of his sculpture garden for fundraising. In 1966 Hirshhorn donated much of his collection, consisting of 6,000 paintings and sculptures from the 19th and 20th centuries (and constituting one of the world's largest private art treasures), to the United States government, along with a $2 million endowment. The Smithsonian Institution established the Joseph H. Hirshhorn Museum and Sculpture Garden in Washington, D.C., in 1966 to hold the collection; the museum opened in 1974. At Hirshhorn's death in 1981, he willed an additional 6,000 works and a $5 million endowment to the museum. Controversy. His business dealings in Canada were not without controversy. He was investigated by the Ontario Securities Commission, convicted twice of breaking Canadian foreign exchange laws, deported from Canada for illegal stock manipulation (which he later appealed and won by having himself declared a landed immigrant), and fined for an illegal securities sale and illegally smuggling cash out of Canada. Personal life. Hirshhorn's first wife was Jennie Berman. They were married in 1922 and separated in 1941 (19 years). They had four children, daughters Robin Gertrude (b. 1923), Gene Harriet (b. 1926), and Naomi Caryl (b. 1931), and son Gordon (b. 1929). He was married to portraitist and book illustrator Lily Harmon from 1947–1956 (9 years). The couple adopted two daughters, Amy (b. 1948) and Jo Ann (b. 1951). Hirshhorn's third wife was Brenda Hawley Heide. In 1964 he married his fourth wife, Olga Zatorsky. He remained married to her until his death in 1981"
23691470,https://en.wikipedia.org/wiki/FC_Lokomotiv-KMV_Mineralnye_Vody,FC Lokomotiv-KMV Mineralnye Vody,"Abstract. FC Lokomotiv-KMV Mineralnye Vody (Russian: «Локомотив‑КМВ» (Минеральные Воды)) was a Russian football team from Mineralnye Vody. It played professionally in 1986–1992, 1994–1998 and 2001. Their best result was 3rd place in the South Zone of the Russian Second Division in 2001. Team name history."
3969130,https://en.wikipedia.org/wiki/Norman_Partridge,Norman Partridge,"Abstract. Norman Partridge (born May 28, 1958) is an American writer of horror and mystery fiction. He has written two detective novels about retired boxer Jack Baddalach, Saguaro Riptide and The Ten Ounce Siesta. He is also the author of a Crow novel, The Crow: Wicked Prayer, which was adapted in 2005 into the fourth Crow movie, bearing the same name. Mr. Partridge's 2006 novel Dark Harvest, published in a limited edition of 2000 autographed copies and 24 lettered edition copies by Cemetery Dance Publications, was voted one of Publishers Weekly ' s 100 Best Books of 2006. It also won the 2006 Bram Stoker Award for Best Long Fiction, and has been nominated for two more awards in 2007. Dark Harvest was made into a film in 2023. His short stories are collected in the volumes Mr. Fox and Other Feral Tales, Bad Intentions, and The Man with the Barbed Wire Fists. Partridge works as the library's evening circulation supervisor at Saint Mary's College of California. He gave a campus reading of Dark Harvest on October 30, 2019. In October 2010, Cemetery Dance announced the ""Four Days of Halloween"" Limited Edition promotional offer, where from October 29, 2010 to November 1, 2010, they would be offering 10/31: The Butcher's Tale by Norman Partridge, setting the print run at however many books were ordered in that window. As of July, 2022, there has been no development on this book, and apparently no plans from Partridge to deliver a manuscript. Awards, nominations, and honors. Mr. Fox and Other Feral Tales Bad Intentions: The Man with the Barbed-Wire Fists: Dark Harvest: Selected bibliography."
