74046428,https://en.wikipedia.org/wiki/District_Council_Eligibility_Review_Committee,District Council Eligibility Review Committee,"Abstract. District Council Eligibility Review Committee (Chinese: 區議會資格審查委員會) is a Hong Kong government statutory committee, which responsible for review and confirm the eligibility of all candidates for the Hong Kong District Council. The Establishment of District Council Eligibility Committee has already approved by the legislative council and has officially confirmed and effective. It was one of an important part of Hong Kong District Council Elections Reform of 2023. Members of the District Council Eligibility Review Committee include a chairman, 2 to 4 official members and 1 to 3 non-official members. Every member of the Committee shall be appointed by the Chief Executive by notice in the Gazette. According to the law, the District Council Eligibility Review Committee must consult the Committee for Safeguarding National Security of the Hong Kong Special Administrative Region (National Security Committee) whether the candidates of the district councilors are comply or not comply with the requirements of supporting the ""Basic Law of the Hong Kong Special Administrative Region "" and allegiance to the Hong Kong Special Administrative Region of the People's Republic of China. The law requires the committee made the decisions based on the opinions given by the National Security Committee."
43517454,https://en.wikipedia.org/wiki/Earl_Keeley,Earl Keeley,"Abstract. Clarence Keeley (born May 15, 1936) is a former Canadian football quarterback who played six seasons in the Canadian Football League with the BC Lions and Montreal Alouettes. He played college football at the University of Montana. Earl was the founding coach of the Sherwood Park Rams Football club in 1962."
38009809,https://en.wikipedia.org/wiki/Stutterheim_Provincial_Hospital,Stutterheim Provincial Hospital,"Abstract. Stutterheim Hospital is a Provincial government funded hospital in the Amahlathi Local Municipality area in Stutterheim, Eastern Cape in South Africa. The hospital departments include Emergency department, Paediatric ward, Maternity ward, Out Patients Department, Surgical Services, Medical Services, Operating Theatre & CSSD Services, Pharmacy, Anti-Retroviral (ARV) treatment for HIV/AIDS, Post Trauma Counseling Services, X-ray Services, Physiotherapy, Laundry Services, Kitchen Services and Mortuary."
15465521,https://en.wikipedia.org/wiki/3rd_Arabian_Gulf_Cup,3rd Arabian Gulf Cup,"Abstract. The 3rd Arabian Gulf Cup (Arabic: دورة كأس الخليج العربي الثالثة) was the third edition of the Arabian Gulf Cup. The tournament was held in Kuwait City, Kuwait and was won by two-time defending champions and hosts Kuwait. The tournament took place between 15 and 29 March 1974. All matches were played at the Al Kuwait Sports Club Stadium. Oman took part in the competition for the first time. Kuwait defeated Saudi Arabia 4–0 in the final to win their third title in a row. This victory meant that Kuwait had earned the privilege of keeping the trophy permanently. The number of teams was increased from five to six and the format of the competition was changed. Instead of one round-robin group, the six nations would be split into two groups of three. The top two from each group qualify for the semi-finals with each group winner facing the other group's runner-up. The winners of each semi-final would face each other in the final while the losers would play in the third-place play-off. First round. All times are local, AST (UTC+3). Knockout stage. All times are local, AST (UTC+3). Statistics."
50186838,https://en.wikipedia.org/wiki/Atlante_(private_equity_fund),Atlante (private equity fund),"Abstract. Atlante is an Italian banking sector owned bail-out equity fund that is dedicated to recapitalize some Italian banks, as well as purchase the securities of the junior tranches of non-performing loans. It was established in 2015 in response to the Italian bad debt crisis of that year. The fund was under regulation by the EU Alternative Investment Fund Managers Directive. According to Federico Ghizzoni, former CEO of UniCredit, although the bank may inject €1 billion to the fund, the bank had a priority to sell their bad loan to the fund. UniCredit had about €20 billion net value of bad loans on the balance sheets as of 31 December 2015. Moreover, both UniCredit and Intesa Sanpaolo (via Banca IMI) were already underwritten Banca Popolare di Vicenza and Veneto Banca for a combined €2.5 billion capital increase. The contributions of the fund would make the fund become the buyer of the unsold shares, instead of the banks themselves. As BPVi announced that the new shares would be priced between €3 and €0.1 per share, the fund on behalf of UniCredit would purchase the unsold share for €0.1 only. It was reported that banking foundations, such as Fondazione Cariplo, Fondazione Cariparo, Compagnia di San Paolo and Fondazione CRT, which in previous banking reforms were forced to sell their banking subsidiaries (forced to diversify investments), were invited to invest in the fund. According to ACRI, the foundations had €40 billion shareholders' equity, with most of them no longer owning their banks in majority or entirely sold. Fondazione Cariplo, a shareholder of Intesa Sanpaolo and the management firm of the fund, had a shareholders' equity of €8.9 billion. On 29 April 2016 Quaestio announced that the fund had collected €4.249 billion from 67 investors including Cassa Depositi e Prestiti. Backgrounds. Responses. Fitch Ratings announced that the contributions to the fund may weaken the large banks. While Reuters, Financial Times expressed that Italian banking problem is too big for the fund. Operations. Management. The fund was managed by Quaestio Capital Management SGR S.p.A., a wholly owned subsidiary of Quaestio Holding S.A., which was owned by Fondazione Cariplo (37.65%), Fondazione Cassa dei Risparmi di Forlì (6.75%), Cassa Italiana di Previdenza e Assistenza dei Geometri liberi professionisti (18%), Locke S.r.l. (22%) and Direzione Generale Opere Don Bosco (15.60%) as of 2018. Shareholders. Atlante II. On 8 August 2016 the second fund, Atlante II, had raised €1.715 billion in order to finance the purchase of NPLs. On 28 August 2016 the fund manager employed Credito Fondiario as service provider in NPLs. On 29 July 2016 Atlante signed a memorandum of understanding to buy the mezzanine notes of the securitized bad loan portfolio of Banca Monte dei Paschi di Siena. BMPS was the weakest banks among the 51 banks of 2016 European Union bank stress test. The deal was finalized in 2018, with Atlante II was the actual buyer, for 95% mezzanine notes for a purchase price of €805 million. In 2017, Atlante II was renamed to Italian Recovery Fund. The fund purchased the NPLs from the savings banks from Cesena, Rimini and San Miniato. The three banks were purchased by Crédit Agricole Italia with a condition to clean-up the NPLs before the deal."
73563736,https://en.wikipedia.org/wiki/2023_Portsmouth_City_Council_election,2023 Portsmouth City Council election,"Abstract. The 2023 Portsmouth City Council election took place on 4 May 2023 to elect members of Portsmouth City Council in Hampshire, England. This was on the same day as other local elections across England. The council remained under no overall control, being led by a Liberal Democrat minority administration. Immediately after the election the Liberal Democrat leader of the council, Gerald Vernon-Jackson, announced he was stepping down from the role. He was replaced at the subsequent annual council meeting on 16 May 2023 by Steve Pitt. Summary. Ward results. Comparisons for the purpose of determining a gain, hold or loss of a seat, and for all percentage changes, is to the last time these specific seats were up for election in 2019. An asterisk indicates the incumbent councillor. The results for each ward were:"
68447461,https://en.wikipedia.org/wiki/Hyphydrus_lyratus,Hyphydrus lyratus,"Abstract. Hydrovatus lyratus, is a species of predaceous diving beetle widespread in South Asia, South East Asia and Australian region. Subspecies. Four subspecies have been identified. Biology. Third instar has a fusiformate body with elongated frontoclypeus. Lateral notches are absent and gular sutures are fused. Siphon elongated, acute apically, with secondary spines. Head length is 1.03 to 1.29 mm. Cephalic capsule pear-shaped, and tapering posteriorly. Cephalic capsule is mainly creamy white to pale yellow i color dorsally, with a longitudinal brownish stripe laterally. Antenna with four-segments, and slightly shorter than head capsule. Mandibles are falciform, and narrow. Pronotum trapezoidal dorsally, and ovate laterally. Pronotum creamy white to pale yellow. Legs are with five segments and pale yellow to pale brown in color. Abdomen consists with eight segments. Adult beetle has longer smooth-edged metatibial spine. The second sternite of male has a sharp, backwardly projecting process. In female, disc of elytron has a distinct, longitudinal groove. Protarsi and mesotarsi are similarly expanded. Ventrite 2 consists with a midline large spine. Elytron lacks a macula."
30797,https://en.wikipedia.org/wiki/Tarja_Halonen,Tarja Halonen,"Abstract. Tarja Kaarina Halonen (pronounced; born 24 December 1943) is a Finnish politician who served as the 11th president of Finland, and the first and to date only woman to hold the position, from 2000 to 2012. She first rose to prominence as a lawyer with the Central Organisation of Finnish Trade Unions (SAK), and as the Prime Minister 's parliamentary secretary (1974–1975) and a member of the City Council of Helsinki (1977–1996). Halonen was a Social Democratic Party member of parliament from 1979 until her election to the presidency in 2000. She also served as a minister at the Ministry of Social Affairs and Health from 1987 to 1990, as Minister of Justice from 1990 to 1991, and as Minister for Foreign Affairs from 1995 to 2000. Halonen was an extremely popular president, with her approval ratings reaching a peak of 88 percent in December 2003. She was re-elected in 2006, defeating National Coalition Party candidate Sauli Niinistö in the second round by 51% to 48%. Ineligible to run in the 2012 presidential elections because of term limits, Halonen left office on 1 March 2012 and was succeeded by Niinistö. Widely known for her interest in human rights issues, Halonen served as the chairperson of the Finnish LGBT rights organization Seta in the 1980s, and she actively participated in the discussion of issues such as women's rights and the problems of globalization during her presidency. In 2006, she was mentioned by various commentators as a potential candidate for the United Nations Secretary-General selection, but she denied an interest at that time, stating that she wanted to finish her term as president before thinking about other career options. In 2009, Forbes named her among the 100 most powerful women in the world. Halonen is a member of the Council of Women World Leaders, an international network of current and former women presidents and prime ministers whose mission is to mobilize the highest-level women leaders globally for collective action on issues of critical importance to women and equitable development. Since the death of Martti Ahtisaari in 2023, Halonen is currently the oldest living former president of Finland. Early life and career. Tarja Halonen was born on 24 December 1943 in the district of Kallio, which at the time was a traditional working-class area in central Helsinki. Her mother Lyyli Elina Loimola was a set-dresser and her father Vieno Olavi Halonen worked as a welder. Halonen's parents married at the beginning of World War II and Tarja was born a few years later. Vieno Halonen was at the frontline during the Continuation War and Lyyli Halonen was working in a shoe factory when their daughter was born. When Halonen was two years old, her father Vieno Halonen went to the kiosk to buy a magazine and no longer returned home to his family. Halonen has not commented much on the incident since, but Halonen's parents officially divorced in 1948. Vieno Halonen was an award-winning soldier who fought in the 26th Infantry Regiment, so-called Ace Regiment. Vieno Halonen was wounded three times during the war and after the war he was awarded first, second and fourth class Order of the Cross of Liberty medals. In later interviews, Tarja Halonen has said that she has met her father only a few times. After the divorce, in 1950, Lyyli Halonen married her new husband Thure Forss, who worked as an electrician and was very active in the working-class community. Both Halonen's mother and her stepfather influenced her world view extensively. Halonen later said that her mother was a true survivor, always an extremely active and resilient person who valued good, honest and modest hardworking people. When she entered politics, Halonen stated that these are also the qualities and attributes she respects in people. In 1950 she began her studies in Kallio Elementary school from where she later moved to Kallio Gymnasium and finally finished her matriculation examination in 1962. She began to study Art History in the University of Helsinki in 1962 but in autumn 1963 she changed her studies to law, and obtained her Master of Laws degree in 1968 specializing in criminal law. She began to work as a lawyer, already before obtaining her degree, in a credit surveillance company Luotonvalvonta oy in 1967. After working there for a few years, she was hired by the National Union of University Students in Finland to work as a Social Affairs and General Secretary from 1969 to 1970. Her work in the Union spurred her interest in politics, and in 1970 she obtained a post as a lawyer in the Central Organisation of Finnish Trade Unions, being the first female ever to work as a lawyer in the Union. Political career: 1970–2000. Presidential campaign. Presidency. Political views. Early in her political career Halonen represented the far-left wing of the SDP. She publicly opposed the proposed free trade agreement of the European Economic Community in 1973, by signing a petition along with 500 other prominent social democrats and socialists. Otherwise she was loyal to President Kekkonen 's foreign policy, which was founded on Finnish neutrality and good relations with the Soviet Union. Markku Salomaa's 2021 book Tarza – Pasifistin odysseia voimapolitiikan maailmassa states that Chancellor Angela Merkel had a very negative attitude towards Halonen, precisely because of her pro-Soviet and far-left wing world of ideas. Since 2004, rumors have been circulating on Internet that Halonen gave a May Day speech at Hakaniemi Market Square in 1976 and hoped that Finland would join the Soviet Union, saying: ""Finland would be blessed to join the Soviet Union by peaceful means. At the same time, we would get rid of the yoke of capitalism, because capitalism will die in 20 years. Finland, together with the Soviet Union, could be a pioneer towards a communist society."" In an interview with STT, Halonen herself has completely rejected the gossip, saying: ""I have not given any May Day speech in Hakaniemi in 1976, nor can the text be found in the Informant. And if a Social Democrat SAK lawyer had given such a May Day speech in the 1970s, the employment relationship would have been rather short."" Throughout her political career, Halonen has described herself as a supporter of ""international solidarity"". She describes herself as a ""relative pacifist"", meaning that she does not support unilateral disarmament. She has strongly defended the President's role as the commander in chief of the military. She opposed NATO membership during her tenure. Following the 2022 Russian invasion of Ukraine, when Finnish public opinion had turned, and the Parliament had debated the issue and decided, in favor of submitting an application for NATO membership, Halonen also voiced her support on Twitter, calling the move ""a necessary measure in the changed security situation in Europe"". Her strong stands on these issues have characterised her presidential term and shaped Finnish foreign policy, in part in cooperation with the like-minded former Minister of Foreign Affairs, Erkki Tuomioja. Halonen has publicly supported the involvement of the Central Organisation of Finnish Trade Unions (SAK) in politics. The Constitution of Finland and Halonen's decision to take part in some European Union meetings with the Prime Minister has created the so-called ""problem of two dinner plates"" in Finland. Since most other countries only have their Prime Ministers representing them, it was also decided in Finland that the task is reserved for the Prime Minister in most cases. On 20 March 2013, Halonen publicly voiced her support for same-sex marriage. Personal life. President Halonen says her interests include art history, the theatre and swimming. She says she speaks Finnish, Swedish, and English, and is studying Estonian. Halonen had two cats during her presidential term. After they died, she was given a Neva Masquerade cat in 2013 by Russian prime minister Dmitry Medvedev. On 26 August 2000, President Halonen married her longtime partner, Dr. Pentti Arajärvi, in a civil ceremony at her official residence, Mäntyniemi, after a relationship of more than fifteen years. Halonen's adult daughter Anna, and Arajärvi's adult son Esko, acted as witnesses. Both children are from previous relationships. She promotes Finland in her personal accoutrements, such as wearing a Moomin watch. In the 1960s, she left the Evangelical Lutheran Church of Finland, to which the majority of Finns belong, to protest against its policy of taxing church members and its stance against female priests. The church has since accepted women as priests, and Halonen has stated that she has no personal reason not to return to the church but refrains from doing so in order not to give a signal that might be misinterpreted. In the 1990s, Halonen acted as the chairman of Suomen setlementtiliitto, a Christian social work organization. After her presidential term, Halonen rejoined the Evangelical-Lutheran Church. According to her statements, she had previously refrained from it as it might have been considered an attempt to garner political support. Since then, Halonen has even preached publicly in a divine service of her home parish of Kallio. This is a privilege that the parish priest may grant only in exceptional cases to persons known for their Christian conviction. In 1980–1981 Halonen served as the chairman of Seta, the main LGBT rights organization in Finland. Positions. Criticism. Halonen was criticized on her views that the Covid-19-pandemic was handled better in countries with female leaders. Former Estonian President Toomas Hendrik Ilves and Finnish author Sofi Oksanen have been strongly criticizing Halonen for her over-optimistic views about Putin and unwillingness to publicly condemn Russia’s hostilities in the neighboring countries, e.g. when Russia invaded Georgia in 2008, Halonen publicly belittled President Ilves’s concerns of the negative geo-political development being just ”Post Sovietal stress”. Even when Russian army invaded Ukraine, Halonen kept quiet. Honours and awards. In popular culture. A long-running joke, which stems from the recurring segment ""Conan O'Brien Hates My Homeland "", is that American talk show host Conan O'Brien resembles Tarja Halonen. After joking about this for several months (which led to his endorsement of her campaign), O'Brien travelled to Finland, appeared on several television shows and met President Halonen. The trip was filmed and aired as a special. Halonen also appears as an animated character in the political satire TV series The Autocrats."
57317440,https://en.wikipedia.org/wiki/Agrilus_lacustris,Agrilus lacustris,Abstract. Agrilus lacustris is a species of metallic wood-boring beetle in the family Buprestidae. It is found in North America.
41418518,https://en.wikipedia.org/wiki/Ostorij,Ostorij,"Abstract. Ostorij (Persian: استريج, also Romanized as Ostorīj; also known as Esterīch, Maḩalleh-ye Osrīj, and Osţorīch) is a village in Sakhvid Rural District, Nir District, Taft County, Yazd Province, Iran. At the 2006 census, its population was 47, in 21 families."
50712513,https://en.wikipedia.org/wiki/1980_Antwerp_attack,1980 Antwerp attack,"Abstract. On 27 July 1980, Said Al Nasr, a Syria-born Palestinian, used grenades to attack a group of 40 Jewish children waiting with their families for a bus to take them to summer camp. One boy was killed and 20 other people were wounded in the attack. The attacker was convicted. Attack. The attack took place outside the Agoudath Israel cultural centre in Antwerp. The group of children, aged 10 to 14, originating from Britain, France, the Netherlands, Austria, and Belgium, were accompanied by their families as they waited to board a bus to take them to a summer camp in the Ardennes hills of southern Belgium. The explosion killed one boy, 15-year-old Parisian David Kohane, and wounded 20, aged 8 to 27, eight of whom had to be hospitalized, including a 13-year-old Belgian girl with critical brain injuries and a pregnant woman. 2 young brothers Zevi and Motti Glejser aged 8 and 9 respectively were walking past at the time of the attack and were wounded and hospitalised. The attacker was arrested after witnesses chased him down. In addition to the thrown grenades, he was carrying a pistol and ""several magazines of ammunition"" that had not used in the attack. The attack was among a number of anti-Jewish attacks worldwide in the early 1980s. Perpetrator. Al Nasr is a Syrian-Palestinian, was convicted in Belgium in 1980, for throwing two hand grenades into a group of Jewish children waiting for a bus in Antwerp on 27 July 1980. He was carrying a Moroccan passport at the time of his arrest. In 1990, the jailed Al Nasr was ""traded"" for part of the Houtekins-Kets family, a Belgian-French family kidnapped in Libya —a demand of the Abu Nidal group—during the Silco incident."
