8825549,https://en.wikipedia.org/wiki/Adam_Seybert,Adam Seybert,"Abstract. Adam Seybert (May 16, 1773 – May 2, 1825) was an American politician who served as a Democratic-Republican member of the U.S. House of Representatives for Pennsylvania's 1st congressional district from 1809 to 1815 and 1817 to 1819. He was a faculty member at the University of Pennsylvania and a mineralogist who organized the first mineralogy collection in the United States in the 1790s. Early life and education. Seybert was born on May 16, 1773, in Philadelphia, Pennsylvania. He graduated in 1793 with a degree in medicine from the University of Pennsylvania. He continued his studies in Europe, and attended schools in Edinburgh, Göttingen, and Paris. He studied mineralogy at the Ecole des Mines and was the first American to study mineralogy in Germany. He returned to Philadelphia with a collection of minerals and worked as a physician for a short time before establishing himself as a ""druggist, chemist and apothecary"". He was a faculty member at the University of Pennsylvania. He was elected as a member of the American Philosophical Society in 1797, and a Fellow of the American Academy of Arts and Sciences in 1824. Political career. In 1809, Seybert was elected to the 11th United States Congress as a Democratic-Republican representative for Pennsylvania's 1st congressional district to fill the vacancy caused by the resignation of Benjamin Say. He was reelected to the Twelfth and Thirteenth Congresses. He was chairman of the United States House Committee on Revisal and Unfinished Business during the Twelfth Congress. He was again elected to the Fifteenth Congress and served from 1817 to 1819. He visited Europe from 1819 to 1821 and again in 1824 and settled in Paris, France, where he died May 2, 1825. He was originally interred at Père Lachaise Cemetery in Paris and re-interred to Laurel Hill Cemetery in Philadelphia. Mineralogy. Seybert established the first mineralogy collection in the United States in the 1790s. The collection contained over 1,725 crystals and rocks. The noted mineralogist, Benjamin Silliman, was known to have traveled to Philadelphia to view the collection, and have Seybert analyze minerals from Silliman's collection. In 1812, Seybert sold his mineralogy collection to the Academy of Natural Sciences in Philadelphia. His political career took priority over his interest in mineralogy, and when Parker Cleaveland wrote to him in December of 1813 with questions on mineralogy, he replied that he had lost interest in the science. Legacy. After Seyberts' death, his mineralogy collection was put on display at the Free Natural History Museum of the Academy of Natural Sciences in Philadelphia. The University of Pennsylvania philosophy department named a chair in the department the Adam Seybert Professor in Moral and Intellectual Philosophy. The chair was funded by Adam's son, Henry Seybert. The duties of the chair included hosting the Adam Seybert committee which investigated the possibility of the spirit world. The committee met from 1883 to 1887 but was unable to discover any evidence and subsequent holders of the chair were freed from continuing the investigations. Publications."
17417025,https://en.wikipedia.org/wiki/1946_Tasmanian_state_election,1946 Tasmanian state election,"Abstract. The 1946 Tasmanian state election was held on 23 November 1946 in the Australian state of Tasmania to elect 30 members of the Tasmanian House of Assembly. The election used the Hare-Clark proportional representation system — six members were elected from each of five electorates. Incumbent Premier Robert Cosgrove continued to lead the Labor Party into the 1946 election. The Nationalist Party had reformed into the modern Liberal Party, and was led by Neil Campbell. This was Tasmania's first election since the end of World War II. Labor won a majority in the election, although the party's vote was significantly reduced. Cosgrove dominated the government throughout Tasmania's post-war recovery. Distribution of votes."
74300898,https://en.wikipedia.org/wiki/List_of_programmes_broadcast_by_Zee_Marathi,List of programmes broadcast by Zee Marathi,Abstract. Zee Marathi is an Indian Marathi language general entertainment channel which is owned by Zee Entertainment Enterprises. This is the list of programmes broadcast by the channel. Former broadcast. Reality shows.
26115340,https://en.wikipedia.org/wiki/Gej%C5%8D_Station,Gejō Station,"Abstract. Gejō Station (下条駅, Gejō-eki) is a railway station in the city of Tōkamachi, Niigata, Japan operated by East Japan Railway Company (JR East). Lines. Gejō Station is served by the Iiyama Line, and is 82.8 kilometers from the starting point of the line at Toyono Station. Station layout. The station consists of a single side platform serving one bi-directional track. The station is unattended. History. Gejō Station opened on 25 November 1927. With the privatization of Japanese National Railways (JNR) on 1 April 1987, the station came under the control of JR East. Surrounding area."
40535641,https://en.wikipedia.org/wiki/Brynhild_(novel),Brynhild (novel),"Abstract. Brynhild, or The Show of Things is a 1937 novel by H. G. Wells. Plot summary. Rowland Palace is a novelist married to a distant cousin, Brynhild, a ""Quiet Lovely"" who is twelve years younger than he. Inordinately sensitive to criticism, Palace has been withdrawing from a wife who is becoming critical of him. When he decides he needs to engage a publicist to cultivate his neglected public image, he hides his plan. The publicist he chooses, Immanuel Cloote, proves to be an agent with imagination and ""manifest gusto."" Meanwhile, Brynhild meets and becomes the unique confidant of Alfred Bunter, a rising young novelist of whose popular success Palace is jealous. Bunter confides to Brynhild that he is really David Lewis, from Cardiff, who has left his wife and assumed a new identity as an author. Scarcely has he confided in Brynhild, however, than his true identity is exposed by someone who turns out to be Mr. Cloote, intent on sabotaging Rowland Palace's literary competitors. The plight of Bunter/Lewis elicits Brynhild's sympathies. Brynhild, who had been feeling that she was ""too aloof for life,"" gains a new sense of confidence and self-assurance from her brief affair, and the novel closes with the news that she is with child. Themes. Brynhild is principally a literary satire in which Wells mocks developments in the contemporary literary scene in Great Britain, especially with respect to publicity. The novel also scrutinises marital misunderstanding in a comic vein."
19974445,https://en.wikipedia.org/wiki/Olivia_Physical,Olivia Physical,"Abstract. Olivia Physical is a 1982 video collection featuring the singer Olivia Newton-John and various of her songs, most from the album Physical. A somewhat expanded version of the video was aired as an ABC prime-time television special, Let's Get Physical, which was in the top 10 of the Nielsen ratings. In 1983 the video received a Grammy Award as Video of the Year. Legacy. Newton-John was one of the first artists to invest in music videos. The 1978 album Totally Hot was her first one to features videos accompanying all the singles from the album, but they were very simple, being primarily composed of Newton-John singing in the studio. The music videos of the songs on Physical are more complex, and were some of the first to present a plot line, and not just a video of the artist performing the song. According to Olivia Physical video album director, Brian Grant, Newton-John's record company and management were reluctant about the project at first: ""I suppose there was a little nervousness at first. But, got us out here because she liked what we had done"". Newton-John herself was a supporter of the music video industry, as she commented in a Billboard article about the Olivia Physical production: ""I think this is the way albums will go in the future: visuals with the music. I got to be a different personality and play another side of myself."" Track listing. Note Production."
20998165,"https://en.wikipedia.org/wiki/Haydentown,_Pennsylvania","Haydentown, Pennsylvania","Abstract. Haydentown is an unincorporated village which is located on Route 857 in Fayette County, Pennsylvania in the United States. History. John Hayden came to Fayette County, Pennsylvania in 1778, after serving for six months in the Revolutionary War. Being a blacksmith by trade, he soon discovered stone coal (hard coal) and the best of iron ore. There were a few Scotch settled just west of the trading post called Hardbargain. This settlement became known as Georgetown. Sometime around this same time, several Germans organized the settlement of Berlin. Georgetown then became known as Haydenberg, and was patented by John Hayden in 1787. The town subsequently was renamed as Haydentown. Roughly two years later, Hayden dug out what he believed to be limestone from a creek bed of a tributary of the Georges River in Georges Township. Unable to burn the limestone, he took a portion of it to the blacksmith shop, and discovered that it was high quality iron ore. Hayden subsequently was appointed as a captain of a militia company that was raised in the three settlements of Berlin, Georgetown and Hardbargain to drive Indigenous people of the region north and west. For his actions, he was allotted 9,000 acres of land. Because all related land records were destroyed in the War of 1812, and because the United States Congress never passed legislation giving Hayden the right to dispose of his land, only a tract that he donated for the Hayden Cemetery was subsequently honored. That cemetery is now known as the White Rock Cemetery. Legacy. By 1910, more iron ore was produced in Haydentown than in the city of Pittsburgh."
38353612,https://en.wikipedia.org/wiki/EduFocal,EduFocal,"Abstract. EduFocal is a social learning website for Primary Exit Profile (PEP) students in Jamaica and Caribbean Secondary Education Certificate (CSEC) students in the Caribbean. The service uses gamification to present its test material to students on the service. Partnerships. In December 2012, the company entered into a partnership with The Jamaica Observer to offer free access to the service through the purchase of a Sunday Observer. The partnership also saw EduFocal expanding its content base to offer not only questions and answers for subjects, but reading content material from the Observer's Study Centre publication. Awards. EduFocal Awards Event. The EduFocal Awards is an annual event by EduFocal that awards the top users on its service with cash and other prizes. The first event was held on July 1, 2013 at the Jamaica Pegasus in Kingston, Jamaica"
54304189,https://en.wikipedia.org/wiki/2017_CONCACAF_Gold_Cup_Group_C,2017 CONCACAF Gold Cup Group C,"Abstract. Group C of the 2017 CONCACAF Gold Cup consisted of title holders Mexico, El Salvador, Curaçao, and Jamaica. Matches began on July 9 and ended on July 16, 2017. Standings. In the quarter-finals: Matches."
63837470,https://en.wikipedia.org/wiki/Carver_Heights_High_School,Carver Heights High School,"Abstract. Carver Heights High School was a segregated public school for black students in Leesburg, Florida. It briefly served as the site of segregated Johnson Junior College as well. It was closed when the schools were integrated. History. Athletics. The school participated as a member of the Florida Interscholastic Athletic Association. The team nickname was the Trojans. Notable people."
18379323,https://en.wikipedia.org/wiki/%C5%BBnin-Wie%C5%9B,Żnin-Wieś,"Abstract. Żnin-Wieś is a village in the administrative district of Gmina Żnin, within Żnin County, Kuyavian-Pomeranian Voivodeship, in north-central Poland."
2537213,"https://en.wikipedia.org/wiki/Torresdale,_Philadelphia","Torresdale, Philadelphia","Abstract. Torresdale, also formerly known as Torrisdale, is a neighborhood in the Far Northeast section of Philadelphia, Pennsylvania, United States. Torresdale is located along the Delaware River between Holmesburg and Bensalem Township in neighboring Bucks County. The adjacent confluence of the Poquessing Creek with the Delaware River had been favored by William Penn 's surveyor, Thomas Holme, as the site for the city that Penn planned to found. Although a more southerly site was finally selected, Holme and others acquired property there, where he is buried. History. Torresdale, originally Torrisdale, was named by Charles Macalester for his family's ancestral Scotland home. Before the Act of Consolidation, 1854, Torresdale had been part of Delaware Township of Philadelphia County, and before 1853, part of Lower Dublin Township of the same county. In 1894, Torresdale was the site of the regatta of the Rowing Association of American Colleges. Long before the existence of what is referred to today as the Philadelphia Main Line, Torresdale, along with Holmesburg to its south and Andalusia to its north, had been Philadelphia's posh suburban neighborhood, as evidenced by Glen Foerd on the Delaware, a luxurious riverside estate and Andalusia, the Biddle estate, for which the village of Andalusia is named. Notable sites. Torresdale is the site of Holy Family University and Nazareth Academy High School. The Union League Golf Club at Torresdale, a Donald Ross –designed golf course, located at Frankford and Grant Avenues, is one of the finest golf courses in the Philadelphia region. In 2015, the Union League of Philadelphia undertook a complete restoration of the course and historic clubhouse, which drew significant national attention. The Frankford Avenue Bridge over Poquessing Creek is listed on the National Register of Historic Places. All Saints' Episcopal Church was established in 1772. Eden Hall Chapel, built in 1849 as part of the former Convent of the Sacred Heart, was demolished in 2007. The municipal Baxter Water Treatment Plant opened in 1909 as the Torresdale Water Treatment Plant. Glen Foerd on the Delaware is a historic estate established in 1850, listed on the National Register of Historic Places and the Historic American Landscapes. Education. Residents are zoned to schools in the School District of Philadelphia, including Thomas Holme Elementary School, Austin Meehan Middle School, and Abraham Lincoln High School. Notable people."
4640623,https://en.wikipedia.org/wiki/Fort_Bliss_National_Cemetery,Fort Bliss National Cemetery,"Abstract. Fort Bliss National Cemetery is a United States National Cemetery in West Texas, located at Fort Bliss, a U.S. Army post adjacent to the city of El Paso. Administered by the Department of Veterans Affairs, it encompasses 82.1 acres (33.2 ha), and as of 2014, had over 50,000 interments. It was listed on the National Register of Historic Places in 2016. History. Fort Bliss itself was not established until the 1840s, but burials were made in the area of the cemetery as early as 1833. The fort was used as a Confederate infantry post during the Civil War, a cavalry post for training during World War I, and then became a demobilization camp after the war. Before Ft. Bliss was moved, soldiers were buried at what is now Cleveland Square and the downtown El Paso Public Library. Union soldiers buried there were removed and reburied at Fort Snelling in 1883. In 1893, this former Ft. Bliss cemetery was granted to the City of El Paso. In 1894, the area where the cemetery is currently located was designated as the Fort Bliss Post Cemetery. In 1914, the cemetery measured just 2.2 acres (0.89 ha); an additional 2.2 acres were added during the war. In 1939, funds were allocated for improvements and plans were approved to designate it a national cemetery. In addition to being the final resting place of American soldiers, Fort Bliss National Cemetery was chosen by the Chinese government as the place of interment for 52 Republic of China Air Force cadets who died while training at the fort in 1944. Several German prisoners of war, and three Japanese civilians who were transferred from a cemetery in Lordsburg, New Mexico were also interred here, as were a German scientist who died while participating in research projects at Fort Bliss during World War II and an officer of the British Royal Air Force who served during that same war. In order to make way for new construction in the central business district in New Orleans, Louisiana in 1955, the remains of the Fort's namesake Lieutenant Colonel William Wallace Smith Bliss (1815–1853) were disinterred from Girod Street Cemetery in New Orleans and brought to Fort Bliss, along with the monument erected in his memory. In June 1973, the Veterans Administration took over operational duties of the cemetery. During the 1990s, twenty acres were added to the cemetery which were given by the Department of the Army. In 2002, the cemetery was using 90 million gallons of water a year to keep the grass in the area green. Plans for xeriscaping the cemetery began discussion in 2002. The xeriscaping was opposed by many because it was felt that xeriscaping looked less dignified or respectful, according to the El Paso Times. In 2007, the cemetery was xeriscaped with a budget of $4.2 million to convert the land. William F. Tuerk, director of the National Cemetery Administration oversaw the change. In 2013, the cemetery won the Texas Environmental Excellence Award because it was saving an average of $400,000 a year because of cutting costs for water and grass upkeep. In 2013, around 100 graves began to sink in the cemetery due to heavy rainfall in the area. Eventually, 1,300 graves were damaged, prompting geologists, Diane Doser and Lixin Jin and Representative Joe Moody to investigate the cause of the problem at the cemetery. Notable monuments. Notable interments."
53867678,https://en.wikipedia.org/wiki/Cythara_diconus,Cythara diconus,"Abstract. Cythara diconus is a species of sea snail, a marine gastropod mollusk in the family Mangeliidae. This species is considered a nomen dubium. Distribution. This marine species occurs off the Philippines."
28848307,https://en.wikipedia.org/wiki/Kurna_(disambiguation),Kurna (disambiguation),Abstract. Kurna may refer to:
57161245,https://en.wikipedia.org/wiki/Buesaco-Aranda_Fault,Buesaco-Aranda Fault,"Abstract. The Buesaco-Aranda Fault (Spanish: Falla Buesaco-Aranda) is a dextral strike-slip fault in the department of Nariño in southwestern Colombia. The fault has a total length of 29 kilometres (18 mi) and runs along an average northeast to southwest strike in the Central Ranges of the Colombian Andes. The 1995 Pasto earthquake is associated with the active fault showing high amounts of displacement. The earthquake caused seven fatalities. Etymology. The fault is named after Buesaco and Aranda, a vereda of Pasto. Other sources call the fault by the general name of Silvia-Pijao Fault. Description. The Buesaco-Aranda Fault, extends in a north-northeast to northeast direction from near the Galeras Volcano in southwestern Colombia. The Buesaco Fault is located 5 kilometres (3.1 mi) to the west of the Aranda Fault. On the eastern block of the Buesaco Fault, the basement rock consists of basic volcanic, andesite and dark sedimentary rocks which probably developed in a marginal basin environment during Early Cretaceous time. On the western block of the fault are a group of low-grade metamorphic rocks which consist of greenschist, amphibolite, quartzite and black schist, all of Paleozoic age. The area is mostly covered by a Pliocene blanket of pyroclastic rocks and calc-alkaline lavas, Quaternary lahar deposits and fluvio -glacial deposits. The Buesaco-Aranda Fault has a very well-defined fault trace, with strongly deformed landforms of Pleistocene-Holocene age, clear breaks in slope along eroded fault scarps, and fault scarps facing both to the southeast or the northwest, which is a characteristic of strike-slip faults. Systematic right lateral deflections of some stream gullies, river channels, and ridges are visible. Offset features in confined alluvial deposits and in recent alluvial fans have fresh scarp morphology. The net cumulative horizontal slip calculated is 188 ± 14 metres (617 ± 46 ft), with 160 ± 10 metres (525 ± 33 ft) of displacement in offset landforms along the Aranda Fault. The Morasurco volcano is enclosed by the Buesaco and Aranda Fault segments."
1178165,https://en.wikipedia.org/wiki/Sadie_Benning,Sadie Benning,"Abstract. Sadie T. Benning (born April 11, 1973) is an American artist, who has worked primarily in video, painting, drawing, sculpture, photography and sound. Benning creates experimental films and explores a variety of themes including surveillance, gender, ambiguity, transgression, play, intimacy, and identity. They became a known artist as a teenager, with their short films made with a PixelVision camera that have been described as ""video diaries"". Benning was a co-founder and a former member of the American electronic rock band Le Tigre, from 1998 until 2001. Early life. Sadie Benning was born April 11, 1973, in Madison, Wisconsin. Benning was raised by their mother in inner-city Milwaukee. Their parents divorced before they were born, their father is film director James Benning. Benning left high school at age 16 due to homophobia. They have identified as non-binary. Work. Music. In 1998, Benning co-founded Le Tigre, the feminist post-punk band whose members include ex-Bikini Kill singer/guitarist Kathleen Hanna and zinester Johanna Fateman. Benning left the band in 2001 and JD Samson joined Le Tigre after Benning's departure. Awards, recognition, and honors. In 1991, the first article about Benning's work, written by Ellen Spiro, appeared in the national gay magazine The Advocate. In 2004, Bill Horrigan curated a retrospective of Benning's works on video. In 2009, Chloe Hope Johnson contributed a chapter in the book There She Goes: Feminist Filmmaking and Beyond (Contemporary Approaches to Film and Media Series) entitled Becoming-Grrrl The Voice and Videos of Sadie Benning. Benning has received grants and fellowships from Guggenheim Fellowship (2005) by the John Simon Guggenheim Memorial Foundation, Rockefeller Foundation grant (1992), Andrea Frank Foundation, and National Endowment of the Arts (NEA). Awards include the Wexner Center Residency Award in Media Arts (2003–2004, which was extended to 2006), National Alliance for Media Arts and Culture Merit Award, Grande video Kunst Award, and the Los Angeles Film Critics Circle Award. Their videos are distributed by Video Data Bank at the School of the Art Institute of Chicago."
6127896,https://en.wikipedia.org/wiki/Szabolcs_Balajcza,Szabolcs Balajcza,Abstract. Szabolcs Balajcza (born 14 July 1979 in Kaposvár) is a Hungarian football goalkeeper who currently plays for Hetes Vikár. Honours. Újpest
35840678,https://en.wikipedia.org/wiki/Face_mask_(We_people),Face mask (We people),"Abstract. An adorned wood face mask from the We (Wee) people of West Africa, dated to the 20th century is in the permanent African collection at the Indianapolis Museum of Art (as acquisition number 1989.373) and on display in the Eiteljorg Suite of African and Oceanic Art. Description. Designed to resemble a snarling leopard, this wooden mask is heavily adorned with a variety of materials to include pigment, shells, cloth, fiber, fur, paper, metal, feathers, and quills. This mask is denoted as male by the cartridge shells along the top and the wood carved leopard's teeth placed along the sides and bottom. Acquisition. A detailed history of this mask is unknown. The work has however been dated to approximately 1900-50 and the acquisition credit line is attributed to a gift from Mr. and Mrs. Harrison Eiteljorg."
