63370132,https://en.wikipedia.org/wiki/Czeslaw_Sokolowski,Czeslaw Sokolowski,"Abstract. Czesław Sokolowski (July 9, 1877, in Warsaw – November 11, 1951, in Michalin) was a Polish Roman Catholic priest, theologian, rector of the Catholic University of Lublin in 1924–1925, and at the Faculty of Catholic Theology at the University of Warsaw. He was auxiliary bishop of Siedlce from 1919 to 1940, titular bishop of Pentacomia and apostolic administrator of the diocese of Siedlce in the years 1940–1946. He was also considered to be a Nazi collaborator. During World War II, he was one of 4 bishops considered collaborators for striking a deal with the Nazi occupation forces. and he was sentenced to death by the Warsaw Area Special Military Court of the Polish Home Army. The verdict, however, was downgraded to a sentence of loss of civil rights and public reputation."
37408977,https://en.wikipedia.org/wiki/Horseshoe_run,Horseshoe run,"Abstract. The Horseshoe run of the Union Steam Ship Company carried passengers and cargo between Australian and New Zealand ports in the late 19th century. Several ships were used from 1882 for about 15 years: the S.S. Hauroto, the S.S. Manapouri, the S.S. Tarawera, and the S.S. Wairarapa: In the early 1890s there was a battle between the Union Co and Huddart Parker on various Australasian routes including the Melbourne-Hobart route, with undercutting by cheap fares and steamers shadowing each other from port to port. On 29 October 1894, the SS Wairarapa wrecked on Great Barrier Island north east of Auckland. Sailing in a dense fog at high speed, the ship rammed into the cliffs at Miner's Point. The hull was breached and the ship immediately started listing. Only 50 passengers and crewmen survived the wreck; 121 were lost. An inquiry later blamed the captain for maintaining excessive speed."
37552376,https://en.wikipedia.org/wiki/James_%26_Ernie,James & Ernie,"Abstract. James & Ernie are an American Navajo comedy duo consisting of James Junes and Ernest ""Ernie"" David Tsosie III. Early life. James Junes grew up in the Kirtland, New Mexico, area, and Ernie Tsosie, born in 1967, was born in Fort Defiance, Arizona. Filmography."
64060612,https://en.wikipedia.org/wiki/Albert_William_Wolters,Albert William Wolters,"Abstract. Albert William Phillip Wolters (1883–1961) was a British psychologist. History. Wolters spent most of his academic career at the University of Reading. He was initially appointed as a lecturer in the Department of Education in 1908. Here he taught courses in Philosophy and Social Institutions. In 1910 he began teaching psychology and he convinced the university authorities to provide him with facilities to establish a psychological laboratory and subsequently a department of psychology. He was made Professor of Psychology and then Deputy Vice-Chancellor of the university. The School of Psychology and Clinical Language Sciences have established a Walter Wolters Visiting Distinguished Professorship. These have been presented by such international figures as Noam Chomsky and Daniel Dennett. Publications. Wolters, A.W.P. (1933). The Evidence of our Senses. London: Methuen. Awards."
58337916,https://en.wikipedia.org/wiki/Yuriy_Fedechko,Yuriy Fedechko,Abstract. Yuriy Fedechko (Ukrainian: Юрій Федечко; born 15 August 1992) is a Ukrainian modern pentathlete. He competed at the 2010 Summer Youth Olympics where he was 12th in individual competition. He is 2015 European champion in men's relay and 2018 European bronze medalist in men's team competition.
38590604,https://en.wikipedia.org/wiki/Kunes_Chapel,Kunes Chapel,"Abstract. Kunes Chapel (Norwegian: Kunes kapell) is a chapel of the Church of Norway in Lebesby Municipality in Troms og Finnmark county, Norway. It is located in the village of Kunes. It is an annex chapel for the Lebesby parish which is part of the Hammerfest prosti (deanery) in the Diocese of Nord-Hålogaland. The small chapel was built in 1982 and it serves the southern part of the municipality of Lebesby."
38922953,https://en.wikipedia.org/wiki/Chandangaon,Chandangaon,"Abstract. Chandangaon is a village in the Chhindwara district in Madhya Pradesh, India. Chandangaon is 4 km from Chhindwara."
13093500,https://en.wikipedia.org/wiki/Hans_Ertel,Hans Ertel,"Abstract. Hans Ertel (March 24, 1904 in Berlin – July 2, 1971 in Berlin) was a German natural scientist and a pioneer in geophysics, meteorology and hydrodynamics. Life and work. Hans Ertel began his scientific career at the former Preußischen Meteorologischen Institut (Prussian Meteorological Institute), where the representatives of the Austrian school of meteorology, (Heinrich von Ficker and Albert Defant) had formative influence on him and gave him their lasting support. Ertel continued the works of Felix Maria von Exner-Ewarten, a leading theoretical meteorologist of his time who lived in Vienna, and he completed many of them. He developed into a capable theoretical physicist early on and he was already to publish research results or theoretical approaches in this subject as a young man. Ertel's famous vorticity equation of 1942 belongs today to the basic work of modern geophysics and astrophysics. In 1943, he was given the position of professor for meteorology and geophysics at the University of Innsbruck, and he also attended lectures by Arnold Sommerfeld. After Second World War, Ertel was interested in a professorship for geophysics at the University of Munich, but was instead appointed to professor for geophysics at Berlin University in 1946, where he also became the director of the Institute for Meteorology and Geophysics which belonged to the university. At the invitation of various scientists, such as Hilding Köhler, Markus Bath and Carl-Gustav Rossby, with whom he also maintained long friendships, Ertel held lectures at Stockholm University and Uppsala University in Sweden and took part in congresses, thereby creating a good reputation for his field of research at the Berlin University. As a member of the Deutschen Akademie der Wisschaften zu Berlin, (German Academy of Sciences Berlin), or DAW, Ertel founded and led the Institute for Physical Hydrography of this academy as of 1948. In 1949, Ertel was elected to be a full member of the DAW and was its vice president from 1951 to 1961. During this time, he saw to the founding of some new academy institutes, and also ensured that all of Germany could participate during the International Geophysical Years (1957/58 and 1958/59). The research on geo-ecology, which began under his leadership at the institute, is considered to be pioneering work today. The following areas of emphasis in research from his time as leader of the Institute enriched scientific knowledge and the subject areas to a great degree: The results of his work were regularly published in specialized international and national magazines (e.g., the Monthly Reports of the German Academy of Sciences), as well as in the magazine of the institute, Acta Hydrophysica, and soon led to a high reputation for himself and for his institute. Even beyond his institute, Ertel made sure that the magazines, Gerlands Beiträge zur Geophysik, Zeitschrift für Meteorologie and Forschungen und Fortschritte appeared and he collaborated on the Deutschen Literaturzeitschrift himself. Furthermore, he held guest lectures abroad, especially at conferences, participated in research trips and supported international projects. Personally, Ertel was concerned with coastal protection, theoretical geomorphology, meteorological problems and cosmology. Selected publications. The following publications are in the Academy Library of the Berlin-Brandenburg Academy of Sciences: Between 1991 and 2006, Wilfried Schröder published Collected Works of Hans Ertel, seven volumes in all, Science Edition, Bremen. A commemorative work appeared on the 100th anniversary of his birth with the title, ""Meteorological and Geophysical Fluid Dynamics"", published by Wilfried Schröder, with contributions by internationally renowned scientists, Science Edition, Bremen. His geophysical works on hydrodynamics appeared as Ertel Collected Works ""Geophysical Fluid Dynamics"", published by Wilfried Schröder, Science Edition, Bremen, 2004. Commemorative articles on Hans Ertel by Wilfried Schröder appeared in EOS (2004), WMO Bulletin (2004), as well as in a review in Idöjaras (Budapest, 2004). A biography of Hans Ertel by Wilfried Schröder was published in the magazine of the Royal Meteorological Society, ""Weather"", in 1999. An article on the life and work of Hans Ertel, also by Wilfried Schröder, is also contained in ""Dictionary of Scientific Biographies""."
73987431,https://en.wikipedia.org/wiki/Hulle_(surname),Hulle (surname),Abstract. Hulle is a surname of Old English origin. Notable people with the surname include:
3356090,https://en.wikipedia.org/wiki/Butterstick,Butterstick,Abstract. Butterstick may refer to:
57723446,https://en.wikipedia.org/wiki/ParentCircle,ParentCircle,"Abstract. ParentCircle, published by Shri Harini Media Ltd, is an Indian mass circulation monthly magazine that features information on parenting and child development geared towards parents. It is based in Chennai, Tamil Nadu. History. The magazine was started in 2011 by Nalina Ramalakshmi, with connection to the Ramco Group. It focuses on parenting, needs of children, and parenting techniques. Their monthly paper features information about child health, safety, behavior, discipline and education. The magazine's first issue was published on April 16, 2011, followed by rapid growth. Parent Circle was funded through internal investment from the Ramco Group family. In November 2021, ParentCircle sponsored a ""#gadgetfreeday"" to encourage children to disconnect from their phones and spend less time on electronic devices. ParentCircle has a circulation of 22K - 30K reaching with around 100,000 total readers."
74011103,https://en.wikipedia.org/wiki/Oligodon_everetti,Oligodon everetti,"Abstract. Oligodon everetti, Everett's kukri snake or jewelled kukri snake, is a species of snakes in the subfamily Colubrinae. It is found in Malaysia and Indonesia."
21886823,https://en.wikipedia.org/wiki/Golczewo-Gaj,Golczewo-Gaj,"Abstract. Golczewo-Gaj (Polish pronunciation:; German: Gülzow) is a settlement in the administrative district of Gmina Golczewo, within Kamień County, West Pomeranian Voivodeship, in north-western Poland. For the history of the region, see History of Pomerania."
36696210,https://en.wikipedia.org/wiki/Ford_City_Armory,Ford City Armory,"Abstract. The Ford City Armory is a historic National Guard armory located at 301 Tenth Street in Ford City, Armstrong County, Pennsylvania. It was designed by architect Joseph F. Kuntz. It was built in 1930. It is a work of builder Clyde Hatten. It is a one-story, ""T""-plan building in Moderne style. It is 10 bays by 9 bays, sits on a cement foundation, and has a hipped roof. It was listed on the National Register of Historic Places in 1989. The building was sold in 1996. It now hosts the Pennsylvania National Guard Military Museum."
36796521,https://en.wikipedia.org/wiki/Van_Klaveren,Van Klaveren,"Abstract. Van Klaveren is a Dutch toponymic surname meaning ""from clovers """", perhaps referring to a dairy farmer's clover field. Notable people with the surname include:"
42787137,https://en.wikipedia.org/wiki/Propaganda_discography,Propaganda discography,"Abstract. The discography of Propaganda (birth name Jason Emmanuel Petty), an American Christian hip hop and spoken word artist and poet from Los Angeles, California, consists of five studio albums, two EPs, twelve compilation appearances, eleven music videos, including one as a featured performer, and twenty-three guest appearances. Discovered by the underground hip hop collective Tunnel Rats, Petty made his debut in 2002 on Speak Life by Sev Statik. On April 8, 2003, he released his solo debut album, Out of Knowhere, with UpRok Records, and recorded as part of the Tunnel Rats on Underground Rise, Volume 1: Sunrise/Sunset. He then recorded with the Tunnel Rats for the collective's 2004 self-titled album. In 2006, he released the I Am Not Them EP with Tunnel Rat Music and recorded Live This as part of the Tunnel Rats-affiliated group Footsoldiers. Footsoldiers also collaborated with KRS-One on his album Life, with Petty appearing on the song ""I Ain't Leaving"", and DJ Tony Touch released a mixtape featuring the group. Petty released a second solo EP, The Sketchbook: A Small Collection of Unreleased Material, independently in 2008, and his second album, Listen Watch Focus, also came out in 2008 through End of Earth Records. Petty's next three albums were all released through the Portland -based Humble Beast Records. The first, entitled Art Ambidextrous, was recorded in collaboration with Odd Thomas, and came out in 2011. Petty's third solo album, Excellent, came out in 2012, and charted at No. 7 on the Billboard Top Gospel chart. Petty's fourth solo album, Crimson Cord came out on April 29, 2014, and charted at No. 5 on the Billboard Top Christian chart, No. 2 on the Top Gospel, and No. 8 on the Top Rap chart."
59606172,https://en.wikipedia.org/wiki/George_Michael:_A_Different_Story,George Michael: A Different Story,"Abstract. George Michael: A Different Story is a 2004 documentary film about the English singer, songwriter and record producer George Michael. It follows Michael's life from joining Wham! in 1981, to the present-day covering his career as a solo artist including personal and professional gain and loss. The film is a British venture produced by Aegean Films with Gorilla Entertainment Limited serving as distributor. Directed by Southan Morris, and produced by Caroline True. A Different Story was initially aired on British television channels BBC One and BBC Three. Despite this, the documentary had its European premiere as part of the 2005 Berlin Film Festival including a press conference on 16 February 2005. The film had a limited cinematic release in sixteen countries. Synopsis. The idea of a documentary evolved because of his former bandmate Andrew Ridgeley being prepared to speak on camera and his father also agreeing to be interviewed.A Different Story begins with Michael on a promotional tour in Milan, Italy for the album Patience released earlier in the year, showing brief clips of Michael in a radio interview with fans outside chanting his name. Filmed over a year, the film chronicles the most up to date events of Michael's life, beginning with his childhood in Hertfordshire, England, reflecting on his time as part of Wham!, and the first on-screen interview together with Ridgeley since the split. ""One way or another, I realised there was the potential here to make a really in-depth documentary about the timeline of my career."" — George Michael Michael discusses his success as a solo artist beginning in 1987 and the big impact of the successful album Faith which earned Michael a Grammy for Album of the Year in 1989 and the battles he had with the public and personal life including his sexuality.During the promotion of the album Michael states that he had been striving to have the same level of success as Michael Jackson and Madonna. However, during the interview he admits that as the Faith Tour ended and it started to fade, ""I felt like I was going insane"". It also touches briefly on the court case with Sony Music and the music business. Other people interviewed for the film include his father Jack Panayiotou, David Austin, Mariah Carey, Geri Halliwell, Elton John, Sting, Noel Gallagher, Simon Cowell and Boy George. Release. An edited 90 minute version of A Different Story was first broadcast on British television channel BBC One in the UK on 27 November 2004, by Gorilla Entertainment Limited. It was then aired on BBC Three with extra footage.Following the broadcasts, the documentary was then screened at the 55th Berlin International Film Festival on the 16 February 2005 with a cinematic release in Germany on 12 January 2006. The North American screening took place at Manhattan 's Tribeca Film Festival between the 25 April and the 7 May 2005. The film was also part of the official selection at the Copenhagen and Rio de Janeiro Film Festivals. The film was released in Japan on 23 December 2005. On 28 February 2006, the British Board of Film Classification announced that the film would receive a 15 certificate rating. It was given a UK limited cinema release on 6 March 2006. Reception."
67504696,https://en.wikipedia.org/wiki/Pinaka_vina,Pinaka vina,"Abstract. ""The essential difference between this instrument and the been is that, in the place of chords it has but one string of wire, strongly stretched. To draw out the sound, a bow like that of a bass is prest upon this chord, at the same time that another part of it is struck or rubbed with a little stick. Frans Balthazar Solvyns, The pināka vīnā (Hindi: पिनाक pinnak + Hindi: वीणा veena) was an Indian musical instrument, a musical bow that was itself played with a bow. It has also been transliterated pinaki vina and pinak. It appeared similar to the rudra veena (also called ""bīn "" or ""been ""), with a long bar held over the musician's shoulder and resting on the ground, with large gourds attached at each end for resonators. However, where the rudra veena has multiple strings and frets, the pinaka vina had only one string made of wire and no frets. Where the rudra veena was a stick zither (with a straight and rigid bar for the instrument's body), the pinaka vīnā was a musical bow (its body a long stick turned up at each end). The instrument was sounded with a bow. The musician chose notes with a stick held against the strings, able to slide it up and down on the string, in the same way a bottle slides on a slide guitar 's strings. Origins. Pinaka was the name of the bow (arrow-shooting variety) of Shiva. The musical bow pināka made it into literature by the 12th century C.E. in the Saraswati Hridayalankar or Bharatbhashya by Nanyadeva (1097–1133 C.E.) In the mid-12th century it was considered to be a very important instrument by Haripala, a Gujarati king (son of Karna). The instrument was recorded in 1456 as having a second resonator. By 1810 the instrument was rare, and much of our knowledge about its appearance comes from drawings made by Frans Balthazar Solvyns, an artist who illustrated many common scenes in the 1790s and early 1800s. As the pinak was a northern instrument, a bowed southern instrument also existed, the ravanahatha stick zither. The pināka and ravanahatha are tied together in literature. As pināka was Shiva's bow, the ravanahatha was created in legend by the ascetic demon king Ravana, a devotee of Shiva."
20793275,https://en.wikipedia.org/wiki/Pseudocharis,Pseudocharis,Abstract. Pseudocharis is a genus of tiger moths in the family Erebidae. It was erected by Herbert Druce in 1884. Species.
11575116,https://en.wikipedia.org/wiki/Pierre_Gibault,Pierre Gibault,"Abstract. Father Pierre Gibault (7 April 1737 – 16 August 1802) was a Jesuit missionary and priest in the Northwest Territory in the 18th century, and an American Patriot during the American Revolution. Frontier Missionary. Gibault was born 7 April 1737 at Montreal, the son of Pierre Gibault and Marie Saint-Jean, and was baptised the same day. He was educated as a missionary and ordained as priest at Quebec on 19 March 1768, and was quickly appointed Vicar General of the Archbishop of Quebec for the Illinois country. When France lost the Northwest Territory to Great Britain in 1763, Jesuit priests were expelled. Catholic communities had to rely on local laity to lead their congregations. In July he arrived at Michilimackinac, where he spent a week attending to the religious needs of the Catholics, some of whom had not seen a priest for many years. Fr. Gibault arrived in Kaskaskia on 8 September 1768, where he served Catholics of French and Indian ethnicity, as well as Irish Catholic soldiers in the British Army 's 18th Regiment of Foot who were stationed there. He first arrived in Vincennes in 1769, where a crowd greeted him with cries of ""Save us, Father; we are nearly in Hell!"" Father Gibault oversaw a circuit of parishes, including Vincennes, Kaskaskia, Ste Genevieve, and Cahokia. He also visited settlements as far as Ouiatenon, Peoria, and St. Joseph. The territory was still considered dangerous frontier, and Gibault carried a gun and two pistols. In 1770 he blessed the little wooden chapel that had been erected at Paincourt, the present site of St. Louis. Gibault officiated at the chapel regularly in spite of being under the authority of the bishop of Quebec and being a British subject, and he performed dozens of masses and sixty-four baptisms until 1772, when a Capuchin priest named Valentine became the first resident priest. The Patriot Priest. Father Gibault was in Kaskaskia in 1778 when George Rogers Clark arrived. According to Clark, Fr. Gibault stated that he supported the Americans, but was concerned for his Catholic congregation. Clark assured him that by the laws of Virginia, they would be free to worship as they wished. Clark also informed Gibault of the newly signed treaty between the United States and France. Gibault convinced the Canadian residents under his care to support the Americans. He further convinced the residents to recognize American continental paper money. Gibault often exchanged Spanish milled dollars for an equal amount of continental promissary notes, and by 1783 estimated that this cost him 7,800 livres. Father Gibault, together with Spanish trader Francis Vigo, is considered to have funded most of the Illinois campaign. Clark told Fr. Gibault of his plans to take Vincennes, but Gibault stated that he could do this without troops. Fr. Gibault and Dr. Jean-Baptiste Laffont (surname variations include LaFond, LaFont) left Kaskaskia on 14 July 1778 and converted an overwhelming majority of Vincennes residents to the American cause. The population raised a new American flag at the abandoned Fort Sackville, wrapping the British flag around a stone and discarding it into the Wabash River. Gibault returned to Kaskaskia and reported the news to Clark. When Lt-Governor Henry Hamilton retook Fort Sackville and Captain Leonard Helm, Gibault found himself confined to Vincennes. Hamilton then captured Francis Vigo, a Spanish citizen and therefore a non-combatant. Father Gibault conducted Sunday mass, then led his entire congregation to Fort Sackville, where he informed Hamilton that all supplies would be denied to the garrison until Vigo was released. Vigo was released, and informed Clark of the capture of Vincennes. Gibault soon returned to Kaskaskia, and blessed a force of Canadians and Virginians led by Clark to re-capture Vincennes in February 1779. For his services to the Americans, Gibault was viewed disfavorably by his fellow clergy, who had remained loyal to the British government. Father Gibault actually requested a move to Quebec in 1788, but was denied by the Bishop due to a disadvantageous opinion that the government had formed of him. In a letter from Cahokia dated 1 May 1790, Father Gibault detailed his services and the debts owed him to Arthur St. Clair. He asked, as a ""concession,"" that the United States would legally grant some land in Kaskaskia- which had traditionally been used by priests- to him and his successors. The request was forwarded on and granted by President George Washington, but the newly appointed American Bishop objected. Without land or compensation, Father Gibault moved to New Madrid, Missouri, pastoring the parish of Saint-Isidore until his death on 16 August 1802. His body was sent to Canada, but his grave is unmarked. Namesakes. Gibault was featured in a collectors coin to celebrate the bicentennial of Indiana statehood."
59734184,https://en.wikipedia.org/wiki/Exits_(song),Exits (song),"Abstract. ""Exits "" is the first single by English indie rock band Foals from their fifth studio album, Everything Not Saved Will Be Lost – Part 1. The song and music video were released on 21 January 2019 in the United Kingdom after its debut on DJ Annie Mac 's BBC Radio 1. This is the band's first single not to feature former bassist Walter Gervers after leaving the group in 2018. A trance remix of the song by British electronic producer, George FitzGerald was released on 7 March 2019. Music video. The music video, directed by Albert Moya features French actress Christa Théret and Game of Thrones star Isaac H. Wright as students at a clandestine fencing academy in a random series of interconnected vignettes of a surrealist nature. The video was filmed in Budapest."
